Sheet: Hoja1
B4: Intensidad en el primario | C4: Ip | D4: 400 | E4: A eficaces
B5: Intensidad en el secundario | C5: Is | D5: 5 | E5: A eficaces
B6: Intensidad secundario pico | C6: Isp | D6: of:=[.D5]*SQRT(2) -> 7.07106781186548
B7: Sensibilidad ACS712ELCTR-05B-T → 0,185 ACS712ELCTR-20A-T → 0,100 | C7: S | D7: 0.1 | E7: V/A
B9: Volge ACS 712 pico | C9: Vap=S x Isp | D9: of:=[.D7]*[.D6] -> 0.707106781186548 | E9: V
B10: V eficaz a 400A | C10: Ve = Vap/ sqrt(2) | D10: of:=[.D9]/SQRT(2) -> 0.5
B12: El factor de corrección el la proporcion entre los amperios del primario que proporcionan 1V eficaz en el arduino
B14: Veficaz a 400A | C14: Ve = Vap/ sqrt(2) | D14: of:=[.D9]/SQRT(2) -> 0.5
B15: Factor de corrección | C15: Fc = Ip / Ve | D15: of:=[.D4]/[.D14] -> 800
B16: Valor de corrección calculado